----------------------------------------------------------------------------------------
 ARP ADDRESSES
-----------------------------------------------------------------------------------------

00:14:51.736549 ARP, Request who-has 192.168.43.193 tell 192.168.43.1, length 28
00:14:51.736567 ARP, Reply 192.168.43.193 is-at 14:2d:27:e8:55:c5, length 28
00:15:06.639218 ARP, Request who-has 192.168.43.193 tell 192.168.43.1, length 28
00:15:06.639236 ARP, Reply 192.168.43.193 is-at 14:2d:27:e8:55:c5, length 28
