
2:23:46.704705 IP 104.113.235.248.443 > 192.168.43.193.43830: Flags [.], ack 3651310666, win 991, options [nop,nop,TS val 4091443058 ecr 1517571], length 0
22:23:46.704778 IP 104.113.234.195.443 > 192.168.43.193.55508: Flags [.], ack 1027215497, win 1029, options [nop,nop,TS val 1239586427 ecr 1517604], length 0
22:23:48.878608 IP 192.168.43.193.45944 > 54.197.238.119.443: Flags [.], ack 2886083293, win 383, options [nop,nop,TS val 1528448 ecr 3536383507], length 0
22:23:48.878843 IP 192.168.43.193.34508 > 104.16.3.9.443: Flags [.], ack 2367595092, win 646, length 0
22:23:48.878847 IP 192.168.43.193.45958 > 54.197.238.119.443: Flags [.], ack 3764992630, win 317, options [nop,nop,TS val 1528448 ecr 3536383507], length 0
22:23:48.878850 IP 192.168.43.193.45952 > 54.197.238.119.443: Flags [.], ack 1673514757, win 338, options [nop,nop,TS val 1528448 ecr 3536383506], length 0
22:23:49.522267 IP 104.16.3.9.443 > 192.168.43.193.34508: Flags [.], ack 1, win 31, length 0
22:23:49.522279 IP 54.197.238.119.443 > 192.168.43.193.45952: Flags [.], ack 1, win 136, options [nop,nop,TS val 3536386166 ecr 1518003], length 0
22:23:49.522291 IP 54.197.238.119.443 > 192.168.43.193.45944: Flags [.], ack 1, win 136, options [nop,nop,TS val 3536386167 ecr 1517992], length 0
22:23:49.522320 IP 54.197.238.119.443 > 192.168.43.193.45958: Flags [.], ack 1, win 136, options [nop,nop,TS val 3536386167 ecr 1517989], length 0
