12:07:28.921767 IP 172.31.4.193.5353 > 224.0.0.251.5353: 0 [4q] [7n] ANY (QM)? 3.1.e.0.8.f.d.b.5.8.8.f.f.0.f.5.0.0.0.0.0.0.0.0.0.0.0.0.0.8.e.f.ip6.arpa. ANY (QM)? linux-11581.local. ANY (QM)? 193.4.31.172.in-addr.arpa. ANY (QM)? f.5.4.7.9.5.6.b.1.7.a.1.1.9.e.7.0.0.0.0.0.0.0.0.0.0.0.0.0.8.e.f.ip6.arpa. (317)
12:07:28.964912 IP6 2001:df0:92:0:90aa:8ad:39c9:b1f.5353 > ff02::fb.5353: 0 [10q] SRV (QM)? SFTP File Transfer on wstation4._sftp-ssh._tcp.local. AAAA (QM)? newaccess.local. SRV (QM)? SFTP File Transfer on newaccess._sftp-ssh._tcp.local. AAAA (QM)? webhome.local. SRV (QM)? SFTP File Transfer on webhome._sftp-ssh._tcp.local. AAAA (QM)? wstation1.local. SRV (QM)? SFTP File Transfer on wstation1._sftp-ssh._tcp.local. AAAA (QM)? Master.local. SRV (QM)? SFTP File Transfer on Master._sftp-ssh._tcp.local. AAAA (QM)? wstation4.local. (292)
12:07:28.964938 IP6 2001:df0:92:0:215:17ff:fe98:d0b8.5353 > ff02::fb.5353: 0*- [0q] 2/0/0 (Cache flush) SRV webhome.local.:22 0 0, (Cache flush) AAAA 2001:df0:92:0:215:17ff:fe98:d0b8 (118)
12:07:28.965104 IP6 2001:df0:92:0:215:17ff:fe98:d09c.5353 > ff02::fb.5353: 0*- [0q] 2/0/0 (Cache flush) SRV newaccess.local.:22 0 0, (Cache flush) AAAA 2001:df0:92:0:215:17ff:fe98:d09c (122)
12:07:28.965109 IP6 2001:df0:92:0:7ae7:d1ff:fe22:af29.5353 > ff02::fb.5353: 0*- [0q] 2/0/0 (Cache flush) SRV Master.local.:22 0 0, (Cache flush) AAAA 2001:df0:92:0:7ae7:d1ff:fe22:af29 (116)
12:07:28.965111 IP6 2001:df0:92:0:219:99ff:fe7a:9c3.5353 > ff02::fb.5353: 0*- [0q] 2/0/0 (Cache flush) AAAA 2001:df0:92:0:219:99ff:fe7a:9c3, (Cache flush) SRV wstation4.local.:22 0 0 (122)
12:07:28.965113 IP6 2001:df0:92:0:219:99ff:fe7a:9d5.5353 > ff02::fb.5353: 0*- [0q] 2/0/0 (Cache flush) SRV wstation1.local.:22 0 0, (Cache flush) AAAA 2001:df0:92:0:219:99ff:fe7a:9d5 (122)
12:07:28.983103 IP 172.31.2.53.137 > 172.31.255.255.137: NBT UDP PACKET(137): QUERY; REQUEST; BROADCAST
12:07:29.002333 IP 172.31.15.56.137 > 172.31.255.255.137: NBT UDP PACKET(137): QUERY; REQUEST; BROADCAST
12:07:29.002839 IP 172.31.15.56.137 > 172.31.255.255.137: NBT UDP PACKET(137): QUERY; REQUEST; BROADCAST
12:07:29.002891 IP 172.31.15.56.137 > 172.31.255.255.137: NBT UDP PACKET(137): QUERY; REQUEST; BROADCAST
12:07:29.003020 IP 172.31.15.56.137 > 172.31.255.255.137: NBT UDP PACKET(137): QUERY; REQUEST; BROADCAST
12:07:29.003101 IP 172.31.15.56.137 > 172.31.255.255.137: NBT UDP PACKET(137): QUERY; REQUEST; BROADCAST
12:07:29.003192 ARP, Request who-has 172.31.15.56 tell 172.31.5.46, length 46
12:07:29.003200 IP 172.31.15.56.137 > 172.31.255.255.137: NBT UDP PACKET(137): QUERY; REQUEST; BROADCAST
12:07:29.042903 IP 172.31.4.202.43011 > 239.255.255.250.1900: UDP, length 171
12:07:29.116473 IP 172.31.4.182.43529 > 239.255.255.250.1900: UDP, length 171
12:07:29.154833 IP 172.31.5.13.59500 > 239.255.255.250.1900: UDP, length 174
12:07:29.169475 ARP, Request who-has 172.31.19.249 tell 172.31.1.41, length 46
12:07:29.172761 IP 172.31.4.193.5353 > 224.0.0.251.5353: 0 [4q] [7n] ANY (QM)? 3.1.e.0.8.f.d.b.5.8.8.f.f.0.f.5.0.0.0.0.0.0.0.0.0.0.0.0.0.8.e.f.ip6.arpa. ANY (QM)? linux-11581.local. ANY (QM)? 193.4.31.172.in-addr.arpa. ANY (QM)? f.5.4.7.9.5.6.b.1.7.a.1.1.9.e.7.0.0.0.0.0.0.0.0.0.0.0.0.0.8.e.f.ip6.arpa. (317)
12:07:29.213548 IP 172.31.4.186.5353 > 224.0.0.251.5353: 0*- [0q] 3/0/0 (Cache flush) PTR linux-212.local., (Cache flush) HINFO, (Cache flush) A 172.31.4.186 (107)
12:07:29.229715 IP 172.31.4.189.52321 > 239.255.255.250.1900: UDP, length 171
12:07:29.270437 IP 172.31.9.136.40353 > 239.255.255.250.1900: UDP, length 172
12:07:29.326954 b0:10:41:94:be:51 > ff:ff:ff:ff:ff:ff Null Supervisory, Receiver not Ready, rcv seq 64, Flags [Poll], length 46
12:07:29.341380 IP6 2001:df0:92:0:c941:ee2a:c860:9aff.5353 > ff02::fb.5353: 0 [4q] SRV (QM)? SFTP File Transfer on radius._sftp-ssh._tcp.local. AAAA (QM)? wstation6.local. SRV (QM)? SFTP File Transfer on wstation6._sftp-ssh._tcp.local. AAAA (QM)? radius.local. (134)
12:07:29.341421 IP6 2001:df0:92:0:215:17ff:feea:f3fc.5353 > ff02::fb.5353: 0*- [0q] 2/0/0 (Cache flush) AAAA 2001:df0:92:0:215:17ff:feea:f3fc, (Cache flush) SRV radius.local.:22 0 0 (116)
12:07:29.341426 IP6 2001:df0:92:0:219:99ff:fe7a:9cd.5353 > ff02::fb.5353: 0*- [0q] 2/0/0 (Cache flush) SRV wstation6.local.:22 0 0, (Cache flush) AAAA 2001:df0:92:0:219:99ff:fe7a:9cd (122)
12:07:29.344797 IP 172.31.14.27.137 > 172.31.255.255.137: NBT UDP PACKET(137): REGISTRATION; REQUEST; BROADCAST
12:07:29.416391 IP 172.31.15.56.137 > 172.31.255.255.137: NBT UDP PACKET(137): QUERY; REQUEST; BROADCAST
12:07:29.417239 IP 172.31.15.56.137 > 172.31.255.255.137: NBT UDP PACKET(137): QUERY; REQUEST; BROADCAST
12:07:29.417275 IP 172.31.15.56.137 > 172.31.255.255.137: NBT UDP PACKET(137): QUERY; REQUEST; BROADCAST
12:07:29.423536 IP 172.31.4.193.5353 > 224.0.0.251.5353: 0 [4q] [7n] ANY (QM)? 3.1.e.0.8.f.d.b.5.8.8.f.f.0.f.5.0.0.0.0.0.0.0.0.0.0.0.0.0.8.e.f.ip6.arpa. ANY (QM)? linux-11581.local. ANY (QM)? 193.4.31.172.in-addr.arpa. ANY (QM)? f.5.4.7.9.5.6.b.1.7.a.1.1.9.e.7.0.0.0.0.0.0.0.0.0.0.0.0.0.8.e.f.ip6.arpa. (317)
12:07:29.438257 IP 172.31.5.20.64702 > 239.255.255.250.1900: UDP, length 173
12:07:29.451858 IP 172.31.11.255.43844 > 23.15.34.19.80: Flags [S], seq 1727768111, win 29200, options [mss 1460,sackOK,TS val 251950 ecr 0,nop,wscale 7], length 0
12:07:29.451976 IP 172.31.11.255.44596 > 172.31.1.130.53: 37434+ A? detectportal.firefox.com. (42)
12:07:29.452026 IP 172.31.11.255.52313 > 172.31.1.130.53: 58145+ AAAA? detectportal.firefox.com. (42)
12:07:29.452470 IP 172.31.1.130.53 > 172.31.11.255.52313: 58145 2/1/0 CNAME detectportal.firefox.com.edgesuite.net., CNAME a1089.d.akamai.net. (181)
12:07:29.452489 IP 172.31.1.130.53 > 172.31.11.255.44596: 37434 4/9/9 CNAME detectportal.firefox.com.edgesuite.net., CNAME a1089.d.akamai.net., A 23.15.34.19, A 23.15.34.8 (473)
12:07:29.452493 IP 23.15.34.19.80 > 172.31.11.255.43844: Flags [S.], seq 637216707, ack 1727768112, win 5792, options [mss 1460,sackOK,TS val 196583631 ecr 251950,nop,wscale 0], length 0
12:07:29.452522 IP 172.31.11.255.43844 > 23.15.34.19.80: Flags [.], ack 1, win 229, options [nop,nop,TS val 251951 ecr 196583631], length 0
12:07:29.452938 IP 172.31.11.255.43844 > 23.15.34.19.80: Flags [P.], seq 1:297, ack 1, win 229, options [nop,nop,TS val 251951 ecr 196583631], length 296: HTTP: GET /success.txt HTTP/1.1
12:07:29.453121 IP 23.15.34.19.80 > 172.31.11.255.43844: Flags [.], ack 297, win 6432, options [nop,nop,TS val 196583631 ecr 251951], length 0
12:07:29.453377 IP 23.15.34.19.80 > 172.31.11.255.43844: Flags [P.], seq 1:416, ack 297, win 6432, options [nop,nop,TS val 196583631 ecr 251951], length 415: HTTP: HTTP/1.1 303 See Other
12:07:29.453405 IP 172.31.11.255.43844 > 23.15.34.19.80: Flags [.], ack 416, win 237, options [nop,nop,TS val 251951 ecr 196583631], length 0
12:07:29.453420 IP 23.15.34.19.80 > 172.31.11.255.43844: Flags [F.], seq 416, ack 297, win 6432, options [nop,nop,TS val 196583631 ecr 251951], length 0
12:07:29.453853 IP 172.31.11.255.43844 > 23.15.34.19.80: Flags [F.], seq 297, ack 417, win 237, options [nop,nop,TS val 251951 ecr 196583631], length 0
12:07:29.454116 IP 23.15.34.19.80 > 172.31.11.255.43844: Flags [.], ack 298, win 6432, options [nop,nop,TS val 196583631 ecr 251951], length 0
12:07:29.454771 IP 172.31.11.255.44441 > 172.31.1.130.53: 1702+ A? gateway.iitk.ac.in. (36)
12:07:29.454825 IP 172.31.11.255.31884 > 172.31.1.130.53: 26157+ AAAA? gateway.iitk.ac.in. (36)
12:07:29.454856 IP 172.31.11.255.34656 > 172.31.1.251.1003: Flags [S], seq 3733096152, win 29200, options [mss 1460,sackOK,TS val 251951 ecr 0,nop,wscale 7], length 0
12:07:29.455094 IP 172.31.1.130.53 > 172.31.11.255.44441: 1702* 1/1/1 A 172.31.1.251 (89)
12:07:29.455112 IP 172.31.1.130.53 > 172.31.11.255.31884: 26157* 0/1/0 (84)
12:07:29.455115 IP 172.31.1.251.1003 > 172.31.11.255.34656: Flags [S.], seq 1009094200, ack 3733096153, win 5792, options [mss 1460,sackOK,TS val 196583631 ecr 251951,nop,wscale 0], length 0
12:07:29.455138 IP 172.31.11.255.34656 > 172.31.1.251.1003: Flags [.], ack 1, win 229, options [nop,nop,TS val 251951 ecr 196583631], length 0
12:07:29.455444 IP 172.31.11.255.34656 > 172.31.1.251.1003: Flags [P.], seq 1:518, ack 1, win 229, options [nop,nop,TS val 251951 ecr 196583631], length 517
12:07:29.455574 IP 172.31.1.251.1003 > 172.31.11.255.34656: Flags [.], ack 518, win 6432, options [nop,nop,TS val 196583631 ecr 251951], length 0
12:07:29.456445 IP 172.31.1.251.1003 > 172.31.11.255.34656: Flags [P.], seq 1:138, ack 518, win 6432, options [nop,nop,TS val 196583631 ecr 251951], length 137
12:07:29.456459 IP 172.31.11.255.34656 > 172.31.1.251.1003: Flags [.], ack 138, win 237, options [nop,nop,TS val 251952 ecr 196583631], length 0
12:07:29.456981 IP 172.31.11.255.34656 > 172.31.1.251.1003: Flags [P.], seq 518:569, ack 138, win 237, options [nop,nop,TS val 251952 ecr 196583631], length 51
12:07:29.457137 IP 172.31.11.255.34656 > 172.31.1.251.1003: Flags [P.], seq 569:910, ack 138, win 237, options [nop,nop,TS val 251952 ecr 196583631], length 341
12:07:29.458385 IP 172.31.1.251.1003 > 172.31.11.255.34656: Flags [P.], seq 138:1977, ack 910, win 7504, options [nop,nop,TS val 196583631 ecr 251952], length 1839
12:07:29.458412 IP 172.31.11.255.34656 > 172.31.1.251.1003: Flags [.], ack 1977, win 266, options [nop,nop,TS val 251952 ecr 196583631], length 0
12:07:29.458419 IP 172.31.1.251.1003 > 172.31.11.255.34656: Flags [FP.], seq 1977:2008, ack 910, win 7504, options [nop,nop,TS val 196583631 ecr 251952], length 31
12:07:29.458802 IP 172.31.11.255.34656 > 172.31.1.251.1003: Flags [F.], seq 910, ack 2009, win 266, options [nop,nop,TS val 251952 ecr 196583631], length 0
12:07:29.459259 IP 172.31.1.251.1003 > 172.31.11.255.34656: Flags [.], ack 911, win 7504, options [nop,nop,TS val 196583631 ecr 251952], length 0
12:07:29.459672 ARP, Request who-has 172.31.1.250 tell 172.31.14.52, length 46
12:07:29.459683 IP 172.31.14.52.59714 > 239.255.255.250.1900: UDP, length 171
12:07:29.459687 ARP, Request who-has 172.31.1.250 tell 172.31.14.52, length 46
12:07:29.503263 ARP, Request who-has 172.31.9.60 tell 172.31.76.248, length 46
12:07:29.518418 IP 172.31.15.251.49668 > 224.0.0.251.5353: 13031- [0q] 6/0/3 PTR 15a5c6ed7d7cdcd982dcbcc81027b2e8._alljoyn._udp.local., SRV 15a5c6ed7d7cdcd982dcbcc81027b2e8.local.:9955 1 1, TXT "txtvers=0", PTR 15a5c6ed7d7cdcd982dcbcc81027b2e8._alljoyn._tcp.local., SRV 15a5c6ed7d7cdcd982dcbcc81027b2e8.local.:9955 1 1, TXT "txtvers=0" (453)
12:07:29.520682 IP6 fe80::e940:593e:caa6:1503.5353 > ff02::fb.5353: 13031- [0q] 6/0/3 PTR 15a5c6ed7d7cdcd982dcbcc81027b2e8._alljoyn._udp.local., SRV 15a5c6ed7d7cdcd982dcbcc81027b2e8.local.:9955 1 1, TXT "txtvers=0", PTR 15a5c6ed7d7cdcd982dcbcc81027b2e8._alljoyn._tcp.local., SRV 15a5c6ed7d7cdcd982dcbcc81027b2e8.local.:9955 1 1, TXT "txtvers=0" (453)
12:07:29.522223 IP 172.31.15.251.49668 > 224.0.0.251.5353: 13033 [2q] [2au] PTR (QU)? _alljoyn._udp.local. PTR (QU)? _alljoyn._tcp.local. (257)
12:07:29.523796 IP6 fe80::e940:593e:caa6:1503.5353 > ff02::fb.5353: 13033 [2q] [2au] PTR (QU)? _alljoyn._udp.local. PTR (QU)? _alljoyn._tcp.local. (257)
12:07:29.539101 IP 172.31.2.127.137 > 172.31.255.255.137: NBT UDP PACKET(137): QUERY; REQUEST; BROADCAST
12:07:29.541868 ARP, Request who-has 172.31.1.34 tell 172.31.1.37, length 46
12:07:29.542981 ARP, Request who-has 172.31.1.11 tell 172.31.1.117, length 46
12:07:29.579462 IP 172.31.8.231.43564 > 255.255.255.255.2008: UDP, length 32
12:07:29.616536 IP 172.31.15.251.49668 > 224.0.0.251.5353: 13031- [0q] 6/0/3 PTR 15a5c6ed7d7cdcd982dcbcc81027b2e8._alljoyn._udp.local., SRV 15a5c6ed7d7cdcd982dcbcc81027b2e8.local.:9955 1 1, TXT "txtvers=0", PTR 15a5c6ed7d7cdcd982dcbcc81027b2e8._alljoyn._tcp.local., SRV 15a5c6ed7d7cdcd982dcbcc81027b2e8.local.:9955 1 1, TXT "txtvers=0" (453)
12:07:29.618837 IP6 fe80::e940:593e:caa6:1503.5353 > ff02::fb.5353: 13031- [0q] 6/0/3 PTR 15a5c6ed7d7cdcd982dcbcc81027b2e8._alljoyn._udp.local., SRV 15a5c6ed7d7cdcd982dcbcc81027b2e8.local.:9955 1 1, TXT "txtvers=0", PTR 15a5c6ed7d7cdcd982dcbcc81027b2e8._alljoyn._tcp.local., SRV 15a5c6ed7d7cdcd982dcbcc81027b2e8.local.:9955 1 1, TXT "txtvers=0" (453)
12:07:29.620347 IP 172.31.15.251.49668 > 224.0.0.251.5353: 13033 [2q] [2au] PTR (QU)? _alljoyn._udp.local. PTR (QU)? _alljoyn._tcp.local. (257)
12:07:29.621919 IP6 fe80::e940:593e:caa6:1503.5353 > ff02::fb.5353: 13033 [2q] [2au] PTR (QU)? _alljoyn._udp.local. PTR (QU)? _alljoyn._tcp.local. (257)
12:07:29.623852 IP 172.31.4.193.5353 > 224.0.0.251.5353: 0*- [0q] 7/0/0 (Cache flush) PTR linux-11581.local., (Cache flush) HINFO, (Cache flush) A 172.31.4.193, (Cache flush) PTR linux-11581.local., (Cache flush) AAAA fe80::7e91:1a71:b659:745f, (Cache flush) PTR linux-11581.local., (Cache flush) AAAA fe80::5f0f:f885:bdf8:e13 (293)
12:07:29.627807 IP6 fe80::d14e:c927:dc56:46a > ff02::16: HBH ICMP6, multicast listener report v2, 1 group record(s), length 28
12:07:29.635432 IP6 fe80::d14e:c927:dc56:46a.54499 > ff02::1:3.5355: UDP, length 22
12:07:29.635455 IP6 fe80::d14e:c927:dc56:46a > ff02::16: HBH ICMP6, multicast listener report v2, 1 group record(s), length 28
12:07:29.636198 IP 172.31.14.27.54499 > 224.0.0.252.5355: UDP, length 22
12:07:29.657423 IP6 fe80::d14e:c927:dc56:46a.546 > ff02::1:2.547: dhcp6 solicit
12:07:29.662901 ARP, Request who-has 172.31.1.130 tell 172.31.9.184, length 46
12:07:29.667018 IP 172.31.5.36.60878 > 239.255.255.250.1900: UDP, length 174
12:07:29.700511 ARP, Request who-has 172.31.1.135 tell 172.31.1.94, length 46
12:07:29.717353 IP 172.31.15.251.49668 > 224.0.0.251.5353: 13031- [0q] 6/0/3 PTR 15a5c6ed7d7cdcd982dcbcc81027b2e8._alljoyn._udp.local., SRV 15a5c6ed7d7cdcd982dcbcc81027b2e8.local.:9955 1 1, TXT "txtvers=0", PTR 15a5c6ed7d7cdcd982dcbcc81027b2e8._alljoyn._tcp.local., SRV 15a5c6ed7d7cdcd982dcbcc81027b2e8.local.:9955 1 1, TXT "txtvers=0" (453)
12:07:29.719648 IP6 fe80::e940:593e:caa6:1503.5353 > ff02::fb.5353: 13031- [0q] 6/0/3 PTR 15a5c6ed7d7cdcd982dcbcc81027b2e8._alljoyn._udp.local., SRV 15a5c6ed7d7cdcd982dcbcc81027b2e8.local.:9955 1 1, TXT "txtvers=0", PTR 15a5c6ed7d7cdcd982dcbcc81027b2e8._alljoyn._tcp.local., SRV 15a5c6ed7d7cdcd982dcbcc81027b2e8.local.:9955 1 1, TXT "txtvers=0" (453)
12:07:29.722631 IP 172.31.15.251.49668 > 224.0.0.251.5353: 13033 [2q] [2au] PTR (QU)? _alljoyn._udp.local. PTR (QU)? _alljoyn._tcp.local. (257)
12:07:29.722662 IP6 fe80::e940:593e:caa6:1503.5353 > ff02::fb.5353: 13033 [2q] [2au] PTR (QU)? _alljoyn._udp.local. PTR (QU)? _alljoyn._tcp.local. (257)
12:07:29.733149 IP 172.31.2.53.137 > 172.31.255.255.137: NBT UDP PACKET(137): QUERY; REQUEST; BROADCAST
12:07:29.837017 IP 172.31.4.158.5353 > 224.0.0.251.5353: 0 [2q] [2n] ANY (QM)? 6.6.3.1.a.7.b.5.3.8.1.c.0.f.7.2.0.0.0.0.0.0.0.0.0.0.0.0.0.8.e.f.ip6.arpa. ANY (QM)? linux-8933.local. (154)
12:07:29.837350 IP 172.31.4.189.5353 > 224.0.0.251.5353: 0*- [0q] 1/0/0 (Cache flush) PTR linux-6228.local. (114)
12:07:29.837358 IP 172.31.4.158.5353 > 224.0.0.251.5353: 0*- [0q] 2/0/0 (Cache flush) A 172.31.4.158, (Cache flush) HINFO (69)
12:07:29.838550 IP 172.31.4.158.5353 > 224.0.0.251.5353: 0*- [0q] 3/0/0 (Cache flush) HINFO, (Cache flush) A 172.31.4.158, (Cache flush) PTR linux-8933.local. (108)
12:07:29.865727 ARP, Request who-has 172.24.127.254 tell 172.24.124.30, length 46
12:07:29.899623 IP 172.31.9.160.63798 > 239.255.255.250.1900: UDP, length 173
12:07:29.952803 IP6 fe80::d14e:c927:dc56:46a > ff02::16: HBH ICMP6, multicast listener report v2, 1 group record(s), length 28
12:07:29.983986 ARP, Request who-has 172.31.5.240 tell 172.31.5.194, length 46
12:07:30.031712 ARP, Request who-has 192.168.137.1 tell 192.168.137.43, length 46
12:07:30.044425 IP 172.31.4.202.43011 > 239.255.255.250.1900: UDP, length 171
12:07:30.046121 IP6 fe80::d14e:c927:dc56:46a.54499 > ff02::1:3.5355: UDP, length 22
12:07:30.046415 IP 172.31.14.27.54499 > 224.0.0.252.5355: UDP, length 22
12:07:30.092886 IP 172.31.14.27.137 > 172.31.255.255.137: NBT UDP PACKET(137): REGISTRATION; REQUEST; BROADCAST
12:07:30.103669 IP 172.31.4.158.5353 > 224.0.0.251.5353: 0 [2q] [3n] ANY (QM)? 158.4.31.172.in-addr.arpa. ANY (QM)? linux-8934.local. (120)
12:07:30.144588 IP6 fe80::209:fff:fe09:d > ff02::1:ff4a:7a53: ICMP6, neighbor solicitation, who has 2001:df0:92:0:d5da:19d8:7c4a:7a53, length 32
12:07:30.147579 IP 172.31.15.56.137 > 172.31.255.255.137: NBT UDP PACKET(137): QUERY; REQUEST; BROADCAST
12:07:30.147965 IP 172.31.15.56.137 > 172.31.255.255.137: NBT UDP PACKET(137): QUERY; REQUEST; BROADCAST
12:07:30.147995 IP 172.31.15.56.137 > 172.31.255.255.137: NBT UDP PACKET(137): QUERY; REQUEST; BROADCAST
12:07:30.169311 IP 172.31.5.13.59500 > 239.255.255.250.1900: UDP, length 174
12:07:30.200950 IP6 2001:df0:92:0:8ddf:c576:a904:b944.5353 > ff02::fb.5353: 0 [2q] SRV (QM)? SFTP File Transfer on wstation2._sftp-ssh._tcp.local. AAAA (QM)? wstation2.local. (86)
12:07:30.200999 IP6 2001:df0:92:0:219:99ff:fe7a:9d3.5353 > ff02::fb.5353: 0*- [0q] 2/0/0 (Cache flush) AAAA 2001:df0:92:0:219:99ff:fe7a:9d3, (Cache flush) SRV wstation2.local.:22 0 0 (122)
12:07:30.230361 IP 172.31.4.189.52321 > 239.255.255.250.1900: UDP, length 171
12:07:30.233524 IP6 fe80::3497:f600:100:fb8e.546 > ff02::1:2.547: dhcp6 solicit
12:07:30.271231 IP 172.31.9.136.40353 > 239.255.255.250.1900: UDP, length 172
12:07:30.279713 IP 172.31.2.127.137 > 172.31.255.255.137: NBT UDP PACKET(137): QUERY; REQUEST; BROADCAST
12:07:30.354573 IP 172.31.4.158.5353 > 224.0.0.251.5353: 0 [2q] [3n] ANY (QM)? 158.4.31.172.in-addr.arpa. ANY (QM)? linux-8934.local. (120)
12:07:30.356514 IP 172.31.15.56.138 > 172.31.255.255.138: NBT UDP PACKET(138)
12:07:30.438835 IP 172.31.5.20.64702 > 239.255.255.250.1900: UDP, length 173
12:07:30.447129 STP 802.1d, Config, Flags [none], bridge-id 8001.e8:ed:f3:96:e6:80.801a, length 43
12:07:30.455819 ARP, Request who-has 172.31.13.200 tell 172.31.5.194, length 46
12:07:30.458820 IP 172.31.14.52.59714 > 239.255.255.250.1900: UDP, length 171
12:07:30.483627 IP 172.31.2.53.137 > 172.31.255.255.137: NBT UDP PACKET(137): QUERY; REQUEST; BROADCAST
12:07:30.498976 ARP, Request who-has 172.31.3.1 tell 172.31.1.250, length 46
12:07:30.507754 ARP, Request who-has 172.31.9.60 tell 172.31.76.248, length 46
12:07:30.539502 ARP, Request who-has 172.31.1.175 tell 172.31.1.250, length 46
12:07:30.542314 ARP, Request who-has 172.31.1.34 tell 172.31.1.37, length 46
12:07:30.579857 IP 172.31.8.231.43564 > 255.255.255.255.2008: UDP, length 32
12:07:30.605115 IP 172.31.4.158.5353 > 224.0.0.251.5353: 0 [2q] [3n] ANY (QM)? 158.4.31.172.in-addr.arpa. ANY (QM)? linux-8934.local. (120)
12:07:30.618175 ARP, Request who-has 172.31.1.60 tell 172.31.7.12, length 46
12:07:30.645675 ARP, Request who-has 151.10.98.98 (ff:ff:ff:ff:ff:ff) tell 151.10.98.98, length 46
12:07:30.671497 IP6 fe80::d14e:c927:dc56:46a.546 > ff02::1:2.547: dhcp6 solicit
12:07:30.682473 IP 172.31.5.36.60878 > 239.255.255.250.1900: UDP, length 174
12:07:30.687667 IP 172.31.14.27.137 > 172.31.255.255.137: NBT UDP PACKET(137): QUERY; REQUEST; BROADCAST
12:07:30.699985 IP 172.31.4.193.5353 > 224.0.0.251.5353: 0*- [0q] 7/0/0 (Cache flush) PTR linux-11581.local., (Cache flush) HINFO, (Cache flush) A 172.31.4.193, (Cache flush) PTR linux-11581.local., (Cache flush) PTR linux-11581.local., (Cache flush) AAAA fe80::7e91:1a71:b659:745f, (Cache flush) AAAA fe80::5f0f:f885:bdf8:e13 (293)
12:07:30.700870 ARP, Request who-has 172.31.1.135 tell 172.31.1.94, length 46
12:07:30.713487 IP 172.31.4.203.5353 > 224.0.0.251.5353: 0 [2q] [2n] ANY (QM)? 6.6.3.1.a.7.b.5.3.8.1.c.0.f.7.2.0.0.0.0.0.0.0.0.0.0.0.0.0.8.e.f.ip6.arpa. ANY (QM)? linux-11216.local. (155)
12:07:30.713509 IP 172.31.4.203.5353 > 224.0.0.251.5353: 0*- [0q] 2/0/0 (Cache flush) A 172.31.4.203, (Cache flush) HINFO (70)
12:07:30.713855 IP 172.31.4.189.5353 > 224.0.0.251.5353: 0*- [0q] 1/0/0 (Cache flush) PTR linux-6228.local. (114)
12:07:30.714340 IP 172.31.4.203.5353 > 224.0.0.251.5353: 0*- [0q] 3/0/0 (Cache flush) HINFO, (Cache flush) A 172.31.4.203, (Cache flush) PTR linux-11216.local. (109)
12:07:30.778359 ARP, Request who-has 172.31.5.240 tell 172.31.5.194, length 46
12:07:30.805297 IP 172.31.4.158.5353 > 224.0.0.251.5353: 0*- [0q] 3/0/0 (Cache flush) PTR linux-8934.local., (Cache flush) HINFO, (Cache flush) A 172.31.4.158 (108)
12:07:30.843240 IP 172.31.14.27.137 > 172.31.255.255.137: NBT UDP PACKET(137): REGISTRATION; REQUEST; BROADCAST
12:07:30.864499 IP 172.31.12.36.51516 > 172.31.255.255.1947: UDP, length 40
12:07:30.873380 IP 172.31.4.203.5353 > 224.0.0.251.5353: 0 [2q] [3n] ANY (QM)? 203.4.31.172.in-addr.arpa. ANY (QM)? linux-11217.local. (121)
12:07:30.903017 IP 172.31.9.160.63798 > 239.255.255.250.1900: UDP, length 173
12:07:31.030065 IP 172.31.2.127.137 > 172.31.255.255.137: NBT UDP PACKET(137): QUERY; REQUEST; BROADCAST
12:07:31.043919 ARP, Request who-has 172.31.1.11 tell 172.31.1.118, length 46
12:07:31.106421 ARP, Request who-has 172.31.7.13 tell 172.31.7.12, length 46
12:07:31.118851 IP 172.31.1.250 > 224.0.0.13: PIMv2, Hello, length 38
12:07:31.123655 IP 172.31.4.203.5353 > 224.0.0.251.5353: 0 [2q] [3n] ANY (QM)? 203.4.31.172.in-addr.arpa. ANY (QM)? linux-11217.local. (121)
12:07:31.145103 IP6 fe80::209:fff:fe09:d > ff02::1:ff4a:7a53: ICMP6, neighbor solicitation, who has 2001:df0:92:0:d5da:19d8:7c4a:7a53, length 32
12:07:31.183816 IP 172.31.5.13.59500 > 239.255.255.250.1900: UDP, length 174
12:07:31.231287 IP 172.31.4.189.52321 > 239.255.255.250.1900: UDP, length 171
12:07:31.244402 IP 172.31.4.186.5353 > 224.0.0.251.5353: 0*- [0q] 3/0/0 (Cache flush) PTR linux-212.local., (Cache flush) HINFO, (Cache flush) A 172.31.4.186 (107)
12:07:31.273244 IP 172.31.9.136.40353 > 239.255.255.250.1900: UDP, length 172
12:07:31.290863 IP6 2001:df0:92:0:291f:8e:cfd5:889d > ff02::1:ff91:5d40: ICMP6, neighbor solicitation, who has fe80::da24:bdff:fe91:5d40, length 32
12:07:31.374495 IP 172.31.4.203.5353 > 224.0.0.251.5353: 0 [2q] [3n] ANY (QM)? 203.4.31.172.in-addr.arpa. ANY (QM)? linux-11217.local. (121)
12:07:31.407362 IP6 fe80::223:e9ff:fef1:ea03 > ff02::1: ICMP6, neighbor advertisement, tgt is fe80::223:e9ff:fef1:ea03, length 32
12:07:31.437325 IP 172.31.14.27.137 > 172.31.255.255.137: NBT UDP PACKET(137): QUERY; REQUEST; BROADCAST
12:07:31.450896 IP 172.31.14.52.5353 > 224.0.0.251.5353: 0 PTR (QM)? _googlecast._tcp.local. (40)
12:07:31.451758 IP6 fe80::25e3:3022:f2ba:22f1.5353 > ff02::fb.5353: 0 PTR (QM)? _googlecast._tcp.local. (40)
12:07:31.452347 IP 172.31.14.52.5353 > 224.0.0.251.5353: 0 PTR (QM)? _googlecast._tcp.local. (40)
12:07:31.453109 IP6 fe80::25e3:3022:f2ba:22f1.5353 > ff02::fb.5353: 0 PTR (QM)? _googlecast._tcp.local. (40)
12:07:31.454442 IP 172.31.14.52.59714 > 239.255.255.250.1900: UDP, length 171
12:07:31.498101 IP 172.31.11.255.42096 > 91.189.89.199.123: NTPv4, Client, length 48
12:07:31.498411 ARP, Request who-has 172.31.1.94 (ff:ff:ff:ff:ff:ff) tell 172.31.1.94, length 46
12:07:31.508230 ARP, Request who-has 172.31.9.60 tell 172.31.76.248, length 46
12:07:31.575513 IP 172.31.4.203.5353 > 224.0.0.251.5353: 0*- [0q] 3/0/0 (Cache flush) PTR linux-11217.local., (Cache flush) HINFO, (Cache flush) A 172.31.4.203 (109)
12:07:31.580252 IP 172.31.8.231.43564 > 255.255.255.255.2008: UDP, length 32
12:07:31.593718 IP 172.31.14.27.137 > 172.31.255.255.137: NBT UDP PACKET(137): REGISTRATION; REQUEST; BROADCAST
12:07:31.618670 ARP, Request who-has 172.31.1.60 tell 172.31.7.12, length 46
12:07:31.679459 IP 172.31.14.52.5353 > 224.0.0.251.5353: 0 SRV (QM)? px4-400d._afpovertcp._tcp.local. (49)
12:07:31.679862 IP 172.31.5.99.5353 > 224.0.0.251.5353: 0*- [0q] 1/0/3 (Cache flush) SRV px4-400d.local.:548 0 0 (126)
12:07:31.698005 IP 172.31.5.36.60878 > 239.255.255.250.1900: UDP, length 174
12:07:31.701585 ARP, Request who-has 172.31.1.135 tell 172.31.1.94, length 46
12:07:31.778907 ARP, Request who-has 172.31.5.240 tell 172.31.5.194, length 46
12:07:31.793626 ARP, Request who-has 172.31.49.253 tell 172.31.13.200, length 46
12:07:31.863659 IP6 2001:df0:92:0:291f:8e:cfd5:889d > ff02::1:ff91:5d40: ICMP6, neighbor solicitation, who has fe80::da24:bdff:fe91:5d40, length 32
12:07:31.890904 IP 172.31.5.97.49259 > 239.255.255.250.1900: UDP, length 101
12:07:31.904017 IP 172.31.9.160.63798 > 239.255.255.250.1900: UDP, length 173
12:07:31.922672 IP 172.31.15.251.49668 > 224.0.0.251.5353: 13034- [0q] 6/0/3 PTR 15a5c6ed7d7cdcd982dcbcc81027b2e8._alljoyn._udp.local., SRV 15a5c6ed7d7cdcd982dcbcc81027b2e8.local.:9955 1 1, TXT "txtvers=0", PTR 15a5c6ed7d7cdcd982dcbcc81027b2e8._alljoyn._tcp.local., SRV 15a5c6ed7d7cdcd982dcbcc81027b2e8.local.:9955 1 1, TXT "txtvers=0" (453)
12:07:31.923003 IP6 fe80::e940:593e:caa6:1503.5353 > ff02::fb.5353: 13034- [0q] 6/0/3 PTR 15a5c6ed7d7cdcd982dcbcc81027b2e8._alljoyn._udp.local., SRV 15a5c6ed7d7cdcd982dcbcc81027b2e8.local.:9955 1 1, TXT "txtvers=0", PTR 15a5c6ed7d7cdcd982dcbcc81027b2e8._alljoyn._tcp.local., SRV 15a5c6ed7d7cdcd982dcbcc81027b2e8.local.:9955 1 1, TXT "txtvers=0" (453)
12:07:31.923045 IP 172.31.15.251.49668 > 224.0.0.251.5353: 13036 [2q] [2au] PTR (QU)? _alljoyn._udp.local. PTR (QU)? _alljoyn._tcp.local. (257)
12:07:31.923351 IP6 fe80::e940:593e:caa6:1503.5353 > ff02::fb.5353: 13036 [2q] [2au] PTR (QU)? _alljoyn._udp.local. PTR (QU)? _alljoyn._tcp.local. (257)
12:07:31.955799 ARP, Request who-has 151.8.98.98 (ff:ff:ff:ff:ff:ff) tell 151.8.98.98, length 46
12:07:31.976842 ARP, Request who-has 172.31.1.11 tell 172.31.1.250, length 46
12:07:32.015681 IP 172.31.15.251.49668 > 224.0.0.251.5353: 13034- [0q] 6/0/3 PTR 15a5c6ed7d7cdcd982dcbcc81027b2e8._alljoyn._udp.local., SRV 15a5c6ed7d7cdcd982dcbcc81027b2e8.local.:9955 1 1, TXT "txtvers=0", PTR 15a5c6ed7d7cdcd982dcbcc81027b2e8._alljoyn._tcp.local., SRV 15a5c6ed7d7cdcd982dcbcc81027b2e8.local.:9955 1 1, TXT "txtvers=0" (453)
12:07:32.021350 IP 172.31.4.158.5353 > 224.0.0.251.5353: 0*- [0q] 3/0/0 (Cache flush) PTR linux-8934.local., (Cache flush) HINFO, (Cache flush) A 172.31.4.158 (108)
12:07:32.054108 ARP, Request who-has 192.168.137.1 tell 192.168.137.43, length 46
12:07:32.075777 IP 172.31.15.251.49668 > 224.0.0.251.5353: 13036 [2q] [2au] PTR (QU)? _alljoyn._udp.local. PTR (QU)? _alljoyn._tcp.local. (257)
12:07:32.075817 IP6 fe80::e940:593e:caa6:1503.5353 > ff02::fb.5353: 13034- [0q] 6/0/3 PTR 15a5c6ed7d7cdcd982dcbcc81027b2e8._alljoyn._udp.local., SRV 15a5c6ed7d7cdcd982dcbcc81027b2e8.local.:9955 1 1, TXT "txtvers=0", PTR 15a5c6ed7d7cdcd982dcbcc81027b2e8._alljoyn._tcp.local., SRV 15a5c6ed7d7cdcd982dcbcc81027b2e8.local.:9955 1 1, TXT "txtvers=0" (453)
12:07:32.075833 IP6 fe80::e940:593e:caa6:1503.5353 > ff02::fb.5353: 13036 [2q] [2au] PTR (QU)? _alljoyn._udp.local. PTR (QU)? _alljoyn._tcp.local. (257)
12:07:32.092393 IP 172.31.2.53.137 > 172.31.255.255.137: NBT UDP PACKET(137): QUERY; REQUEST; BROADCAST
12:07:32.106930 ARP, Request who-has 172.31.7.13 tell 172.31.7.12, length 46
12:07:32.121971 IP 172.31.15.251.49668 > 224.0.0.251.5353: 13034- [0q] 6/0/3 PTR 15a5c6ed7d7cdcd982dcbcc81027b2e8._alljoyn._udp.local., SRV 15a5c6ed7d7cdcd982dcbcc81027b2e8.local.:9955 1 1, TXT "txtvers=0", PTR 15a5c6ed7d7cdcd982dcbcc81027b2e8._alljoyn._tcp.local., SRV 15a5c6ed7d7cdcd982dcbcc81027b2e8.local.:9955 1 1, TXT "txtvers=0" (453)
12:07:32.122007 IP6 fe80::e940:593e:caa6:1503.5353 > ff02::fb.5353: 13034- [0q] 6/0/3 PTR 15a5c6ed7d7cdcd982dcbcc81027b2e8._alljoyn._udp.local., SRV 15a5c6ed7d7cdcd982dcbcc81027b2e8.local.:9955 1 1, TXT "txtvers=0", PTR 15a5c6ed7d7cdcd982dcbcc81027b2e8._alljoyn._tcp.local., SRV 15a5c6ed7d7cdcd982dcbcc81027b2e8.local.:9955 1 1, TXT "txtvers=0" (453)
12:07:32.122025 IP 172.31.15.251.49668 > 224.0.0.251.5353: 13036 [2q] [2au] PTR (QU)? _alljoyn._udp.local. PTR (QU)? _alljoyn._tcp.local. (257)
12:07:32.122029 IP6 fe80::e940:593e:caa6:1503.5353 > ff02::fb.5353: 13036 [2q] [2au] PTR (QU)? _alljoyn._udp.local. PTR (QU)? _alljoyn._tcp.local. (257)
12:07:32.145613 IP6 fe80::209:fff:fe09:d > ff02::1:ff4a:7a53: ICMP6, neighbor solicitation, who has 2001:df0:92:0:d5da:19d8:7c4a:7a53, length 32
12:07:32.203654 IP 172.31.14.27.137 > 172.31.255.255.137: NBT UDP PACKET(137): QUERY; REQUEST; BROADCAST
12:07:32.217373 IP 172.31.9.48.1760 > 172.31.1.153.13000: Flags [S], seq 2933723939, win 65535, options [mss 1460,nop,wscale 1,nop,nop,sackOK], length 0
12:07:32.232152 IP 172.31.4.189.52321 > 239.255.255.250.1900: UDP, length 171
12:07:32.282097 ARP, Request who-has 172.31.1.213 tell 172.31.8.91, length 46
12:07:32.411215 IP6 fe80::223:e9ff:fef1:ea03 > ff02::1: ICMP6, neighbor advertisement, tgt is fe80::223:e9ff:fef1:ea03, length 32
12:07:32.451023 STP 802.1d, Config, Flags [none], bridge-id 8001.e8:ed:f3:96:e6:80.801a, length 43
12:07:32.452321 IP 172.31.14.52.5353 > 224.0.0.251.5353: 0 PTR (QM)? _googlecast._tcp.local. (40)
12:07:32.453083 IP6 fe80::25e3:3022:f2ba:22f1.5353 > ff02::fb.5353: 0 PTR (QM)? _googlecast._tcp.local. (40)
12:07:32.454517 IP 172.31.14.52.5353 > 224.0.0.251.5353: 0 PTR (QM)? _googlecast._tcp.local. (40)
12:07:32.454553 IP6 fe80::25e3:3022:f2ba:22f1.5353 > ff02::fb.5353: 0 PTR (QM)? _googlecast._tcp.local. (40)
12:07:32.460999 IP 172.31.11.255.43848 > 23.15.34.19.80: Flags [S], seq 550501919, win 29200, options [mss 1460,sackOK,TS val 252703 ecr 0,nop,wscale 7], length 0
12:07:32.461135 IP 172.31.11.255.26363 > 172.31.1.130.53: 29101+ A? detectportal.firefox.com. (42)
12:07:32.461157 IP 23.15.34.19.80 > 172.31.11.255.43848: Flags [S.], seq 782649323, ack 550501920, win 5792, options [mss 1460,sackOK,TS val 196583932 ecr 252703,nop,wscale 0], length 0
12:07:32.461191 IP 172.31.11.255.18530 > 172.31.1.130.53: 46999+ AAAA? detectportal.firefox.com. (42)
12:07:32.461199 IP 172.31.11.255.43848 > 23.15.34.19.80: Flags [.], ack 1, win 229, options [nop,nop,TS val 252703 ecr 196583932], length 0
12:07:32.461378 IP 172.31.11.255.43848 > 23.15.34.19.80: Flags [P.], seq 1:297, ack 1, win 229, options [nop,nop,TS val 252703 ecr 196583932], length 296: HTTP: GET /success.txt HTTP/1.1
12:07:32.461641 IP 172.31.1.130.53 > 172.31.11.255.18530: 46999 2/1/0 CNAME detectportal.firefox.com.edgesuite.net., CNAME a1089.d.akamai.net. (181)
12:07:32.461657 IP 172.31.1.130.53 > 172.31.11.255.26363: 29101 4/9/9 CNAME detectportal.firefox.com.edgesuite.net., CNAME a1089.d.akamai.net., A 23.15.34.19, A 23.15.34.8 (473)
12:07:32.461662 IP 23.15.34.19.80 > 172.31.11.255.43848: Flags [.], ack 297, win 6432, options [nop,nop,TS val 196583932 ecr 252703], length 0
12:07:32.461774 IP 23.15.34.19.80 > 172.31.11.255.43848: Flags [P.], seq 1:416, ack 297, win 6432, options [nop,nop,TS val 196583932 ecr 252703], length 415: HTTP: HTTP/1.1 303 See Other
12:07:32.461790 IP 172.31.11.255.43848 > 23.15.34.19.80: Flags [.], ack 416, win 237, options [nop,nop,TS val 252703 ecr 196583932], length 0
12:07:32.461803 IP 23.15.34.19.80 > 172.31.11.255.43848: Flags [F.], seq 416, ack 297, win 6432, options [nop,nop,TS val 196583932 ecr 252703], length 0
12:07:32.462486 IP 172.31.11.255.43848 > 23.15.34.19.80: Flags [F.], seq 297, ack 417, win 237, options [nop,nop,TS val 252703 ecr 196583932], length 0
12:07:32.462595 IP 23.15.34.19.80 > 172.31.11.255.43848: Flags [.], ack 298, win 6432, options [nop,nop,TS val 196583932 ecr 252703], length 0
12:07:32.463580 IP 172.31.11.255.34660 > 172.31.1.251.1003: Flags [S], seq 600758995, win 29200, options [mss 1460,sackOK,TS val 252703 ecr 0,nop,wscale 7], length 0
12:07:32.463588 IP 172.31.11.255.23219 > 172.31.1.130.53: 55779+ A? gateway.iitk.ac.in. (36)
12:07:32.463644 IP 172.31.11.255.30010 > 172.31.1.130.53: 914+ AAAA? gateway.iitk.ac.in. (36)
12:07:32.463816 IP 172.31.1.130.53 > 172.31.11.255.23219: 55779* 1/1/1 A 172.31.1.251 (89)
12:07:32.463833 IP 172.31.1.251.1003 > 172.31.11.255.34660: Flags [S.], seq 1309757735, ack 600758996, win 5792, options [mss 1460,sackOK,TS val 196583932 ecr 252703,nop,wscale 0], length 0
12:07:32.463856 IP 172.31.11.255.34660 > 172.31.1.251.1003: Flags [.], ack 1, win 229, options [nop,nop,TS val 252703 ecr 196583932], length 0
12:07:32.463863 IP 172.31.1.130.53 > 172.31.11.255.30010: 914* 0/1/0 (84)
12:07:32.464306 IP 172.31.11.255.34660 > 172.31.1.251.1003: Flags [P.], seq 1:518, ack 1, win 229, options [nop,nop,TS val 252704 ecr 196583932], length 517
12:07:32.464782 IP 172.31.1.251.1003 > 172.31.11.255.34660: Flags [.], ack 518, win 6432, options [nop,nop,TS val 196583932 ecr 252704], length 0
12:07:32.465611 IP 172.31.1.251.1003 > 172.31.11.255.34660: Flags [P.], seq 1:138, ack 518, win 6432, options [nop,nop,TS val 196583932 ecr 252704], length 137
12:07:32.465640 IP 172.31.11.255.34660 > 172.31.1.251.1003: Flags [.], ack 138, win 237, options [nop,nop,TS val 252704 ecr 196583932], length 0
12:07:32.466210 IP 172.31.11.255.34660 > 172.31.1.251.1003: Flags [P.], seq 518:569, ack 138, win 237, options [nop,nop,TS val 252704 ecr 196583932], length 51
12:07:32.466391 IP 172.31.11.255.34660 > 172.31.1.251.1003: Flags [P.], seq 569:910, ack 138, win 237, options [nop,nop,TS val 252704 ecr 196583932], length 341
12:07:32.468393 IP 172.31.1.251.1003 > 172.31.11.255.34660: Flags [P.], seq 138:1977, ack 910, win 7504, options [nop,nop,TS val 196583932 ecr 252704], length 1839
12:07:32.468443 IP 172.31.11.255.34660 > 172.31.1.251.1003: Flags [.], ack 1977, win 266, options [nop,nop,TS val 252705 ecr 196583932], length 0
12:07:32.468450 IP 172.31.1.251.1003 > 172.31.11.255.34660: Flags [FP.], seq 1977:2008, ack 910, win 7504, options [nop,nop,TS val 196583932 ecr 252704], length 31
12:07:32.469009 IP 172.31.11.255.34660 > 172.31.1.251.1003: Flags [F.], seq 910, ack 2009, win 266, options [nop,nop,TS val 252705 ecr 196583932], length 0
12:07:32.469183 IP 172.31.1.251.1003 > 172.31.11.255.34660: Flags [.], ack 911, win 7504, options [nop,nop,TS val 196583932 ecr 252705], length 0
12:07:32.500984 ARP, Request who-has 172.31.1.94 (ff:ff:ff:ff:ff:ff) tell 172.31.1.94, length 46
12:07:32.508762 ARP, Request who-has 172.31.9.60 tell 172.31.76.248, length 46
12:07:32.512532 IP 172.31.2.127.137 > 172.31.255.255.137: NBT UDP PACKET(137): QUERY; REQUEST; BROADCAST
12:07:32.517450 ARP, Request who-has 172.31.5.200 tell 172.31.5.147, length 46
12:07:32.517461 ARP, Request who-has 172.31.5.240 tell 172.31.5.147, length 46
12:07:32.540026 ARP, Request who-has 172.31.1.175 tell 172.31.1.250, length 46
12:07:32.543217 ARP, Request who-has 172.31.1.34 tell 172.31.1.37, length 46
12:07:32.543470 ARP, Request who-has 172.31.4.192 tell 172.31.1.130, length 46
12:07:32.544413 ARP, Request who-has 172.31.1.11 tell 172.31.1.118, length 46
12:07:32.580593 IP 172.31.8.231.43564 > 255.255.255.255.2008: UDP, length 32
12:07:32.588603 IP 172.31.11.124.4910 > 172.31.1.153.13000: Flags [S], seq 4258139401, win 65535, options [mss 1460,nop,wscale 1,nop,nop,sackOK], length 0
12:07:32.619159 ARP, Request who-has 172.31.1.60 tell 172.31.7.12, length 46
12:07:32.676799 IP6 fe80::d14e:c927:dc56:46a.546 > ff02::1:2.547: dhcp6 solicit
12:07:32.684699 IP 172.31.4.203.5353 > 224.0.0.251.5353: 0*- [0q] 3/0/0 (Cache flush) PTR linux-11217.local., (Cache flush) HINFO, (Cache flush) A 172.31.4.203 (109)
12:07:32.701856 ARP, Request who-has 172.31.1.135 tell 172.31.1.94, length 46
12:07:32.730110 IP 172.31.4.194.5353 > 224.0.0.251.5353: 0 [2q] [2n] ANY (QM)? 9.b.9.3.9.2.a.1.e.d.e.2.7.a.d.9.0.0.0.0.2.9.0.0.0.f.d.0.1.0.0.2.ip6.arpa. ANY (QM)? linux-2590.local. (154)
12:07:32.730136 IP 172.31.4.194.5353 > 224.0.0.251.5353: 0*- [0q] 2/0/0 (Cache flush) A 172.31.4.194, (Cache flush) HINFO (69)
12:07:32.730429 IP 172.31.4.126.5353 > 224.0.0.251.5353: 0*- [0q] 1/0/0 (Cache flush) PTR linux-4423.local. (114)
12:07:32.730899 IP 172.31.4.194.5353 > 224.0.0.251.5353: 0*- [0q] 3/0/0 (Cache flush) HINFO, (Cache flush) A 172.31.4.194, (Cache flush) PTR linux-2590.local. (108)
12:07:32.777259 IP 172.31.4.193.5353 > 224.0.0.251.5353: 0*- [0q] 7/0/0 (Cache flush) PTR linux-11581.local., (Cache flush) HINFO, (Cache flush) A 172.31.4.193, (Cache flush) PTR linux-11581.local., (Cache flush) PTR linux-11581.local., (Cache flush) AAAA fe80::7e91:1a71:b659:745f, (Cache flush) AAAA fe80::5f0f:f885:bdf8:e13 (293)
12:07:32.793409 ARP, Request who-has 172.24.127.254 tell 172.24.124.30, length 46
12:07:32.841910 IP 172.31.2.53.137 > 172.31.255.255.137: NBT UDP PACKET(137): QUERY; REQUEST; BROADCAST
12:07:32.842201 ARP, Request who-has 172.31.49.254 tell 172.31.13.200, length 46
12:07:32.864193 IP6 2001:df0:92:0:291f:8e:cfd5:889d > ff02::1:ff91:5d40: ICMP6, neighbor solicitation, who has fe80::da24:bdff:fe91:5d40, length 32
12:07:32.864548 IP 172.31.15.56.138 > 172.31.255.255.138: NBT UDP PACKET(138)
12:07:32.904711 IP 172.31.9.160.63798 > 239.255.255.250.1900: UDP, length 173
12:07:32.994344 IP 0.0.0.0.68 > 255.255.255.255.67: BOOTP/DHCP, Request from 80:01:84:41:82:b7, length 311
12:07:32.995260 IP 172.31.4.194.5353 > 224.0.0.251.5353: 0 [2q] [3n] ANY (QM)? 194.4.31.172.in-addr.arpa. ANY (QM)? linux-2591.local. (120)
12:07:32.998931 ARP, Request who-has 172.31.1.1 tell 172.31.9.4, length 46
12:07:33.095818 IP 172.31.14.27.137 > 172.31.255.255.137: NBT UDP PACKET(137): QUERY; REQUEST; BROADCAST
12:07:33.107430 ARP, Request who-has 172.31.7.13 tell 172.31.7.12, length 46
12:07:33.246591 IP 172.31.4.194.5353 > 224.0.0.251.5353: 0 [2q] [3n] ANY (QM)? 194.4.31.172.in-addr.arpa. ANY (QM)? linux-2591.local. (120)
12:07:33.249877 IP 172.31.2.127.137 > 172.31.255.255.137: NBT UDP PACKET(137): QUERY; REQUEST; BROADCAST
12:07:33.265296 ARP, Request who-has 172.31.19.250 tell 172.31.1.41, length 46
12:07:33.278769 ARP, Request who-has 172.31.5.200 tell 172.31.5.147, length 46
12:07:33.278785 ARP, Request who-has 172.31.5.240 tell 172.31.5.147, length 46
12:07:33.311802 ARP, Request who-has 172.31.50.25 tell 172.31.1.250, length 46
12:07:33.412172 IP6 fe80::223:e9ff:fef1:ea03 > ff02::1: ICMP6, neighbor advertisement, tgt is fe80::223:e9ff:fef1:ea03, length 32
12:07:33.435520 IP 172.31.1.117.137 > 172.31.255.255.137: NBT UDP PACKET(137): QUERY; REQUEST; BROADCAST
12:07:33.440868 MS NLB heartbeat, host priority: 1, cluster IP: 0.0.0.0, host IP: 0.0.0.0
12:07:33.454092 ARP, Request who-has 172.20.160.20 tell 172.20.167.254, length 46
12:07:33.496768 IP 172.31.4.194.5353 > 224.0.0.251.5353: 0 [2q] [3n] ANY (QM)? 194.4.31.172.in-addr.arpa. ANY (QM)? linux-2591.local. (120)
12:07:33.502487 ARP, Request who-has 172.31.1.94 (ff:ff:ff:ff:ff:ff) tell 172.31.1.94, length 46
12:07:33.504514 IP6 fe80::e940:593e:caa6:1503 > ff02::16: HBH ICMP6, multicast listener report v2, 1 group record(s), length 28
12:07:33.526226 IP6 fe80::e940:593e:caa6:1503 > ff02::16: HBH ICMP6, multicast listener report v2, 1 group record(s), length 28
12:07:33.543688 ARP, Request who-has 172.31.1.34 tell 172.31.1.37, length 46
12:07:33.558303 IP 172.31.15.251.49668 > 224.0.0.251.5353: 13037- [0q] 6/0/3 PTR 15a5c6ed7d7cdcd982dcbcc81027b2e8._alljoyn._udp.local., SRV 15a5c6ed7d7cdcd982dcbcc81027b2e8.local.:9955 1 1, TXT "txtvers=0", PTR 15a5c6ed7d7cdcd982dcbcc81027b2e8._alljoyn._tcp.local., SRV 15a5c6ed7d7cdcd982dcbcc81027b2e8.local.:9955 1 1, TXT "txtvers=0" (453)
12:07:33.559057 IP6 fe80::e940:593e:caa6:1503.5353 > ff02::fb.5353: 13037- [0q] 6/0/3 PTR 15a5c6ed7d7cdcd982dcbcc81027b2e8._alljoyn._udp.local., SRV 15a5c6ed7d7cdcd982dcbcc81027b2e8.local.:9955 1 1, TXT "txtvers=0", PTR 15a5c6ed7d7cdcd982dcbcc81027b2e8._alljoyn._tcp.local., SRV 15a5c6ed7d7cdcd982dcbcc81027b2e8.local.:9955 1 1, TXT "txtvers=0" (453)
12:07:33.559088 IP 172.31.15.251.49668 > 224.0.0.251.5353: 13039 [2q] [2au] PTR (QU)? _alljoyn._udp.local. PTR (QU)? _alljoyn._tcp.local. (257)
12:07:33.559100 IP6 fe80::e940:593e:caa6:1503.5353 > ff02::fb.5353: 13039 [2q] [2au] PTR (QU)? _alljoyn._udp.local. PTR (QU)? _alljoyn._tcp.local. (257)
12:07:33.559876 IP 172.31.15.251.49668 > 224.0.0.251.5353: 13037- [0q] 6/0/3 PTR 15a5c6ed7d7cdcd982dcbcc81027b2e8._alljoyn._udp.local., SRV 15a5c6ed7d7cdcd982dcbcc81027b2e8.local.:9955 1 1, TXT "txtvers=0", PTR 15a5c6ed7d7cdcd982dcbcc81027b2e8._alljoyn._tcp.local., SRV 15a5c6ed7d7cdcd982dcbcc81027b2e8.local.:9955 1 1, TXT "txtvers=0" (453)
